"id","kode_kbli","nama_kbli","keterangan","versi","created_at","created_by_id","rejected_at","rejected_by_id","status","updated_at","verified_at","verified_by_id"
"2758","1468.0","PEMBIBITAN AYAM RAS","","KBLI 2015","11/29/2016 08:19:55","","","","6","11/29/2016 08:19:55","",""
"2759","1495.0","PEMBIBITAN DAN BUDIDAYA KELINCI","","KBLI 2015","11/29/2016 08:19:55","","","","6","11/29/2016 08:19:55","",""
"2760","1496.0","PEMBIBITAN DAN BUDIDAYA CACING","","KBLI 2015","11/29/2016 08:19:55","","","","6","11/29/2016 08:19:55","",""
"2761","1612.0","JASA PEMUPUKAN, PENANAMAN BIBIT/BENIH DAN PENGENDALIAN HAMA DAN GULMA","","KBLI 2015","11/29/2016 08:19:55","","","","6","11/29/2016 08:19:55","",""
"2762","1622.0","JASA PERKAWINAN TERNAK","","KBLI 2015","11/29/2016 08:19:55","","","","6","11/29/2016 08:19:55","",""
"2763","164.0","PEMILIHAN BENIH TANAMAN UNTUK PENGEMBANGBIAKAN","","KBLI 2015","11/29/2016 08:19:55","","","","6","11/29/2016 08:19:55","",""
"2764","1640.0","PEMILIHAN BENIH TANAMAN UNTUK PENGEMBANGBIAKAN","","KBLI 2015","11/29/2016 08:19:55","","","","6","11/29/2016 08:19:55","",""
"2765","17.0","PERBURUAN, PENANGKAPAN DAN PENANGKARAN TUMBUHAN/ SATWA LIAR","","KBLI 2015","11/29/2016 08:19:55","","","","6","11/29/2016 08:19:55","",""
"2766","1711.0","PERBURUAN DAN PENANGKAPAN PRIMATA","","KBLI 2015","11/29/2016 08:19:55","","","","6","11/29/2016 08:19:55","",""
"2767","1712.0","PERBURUAN DAN PENANGKAPAN MAMALIA","","KBLI 2015","11/29/2016 08:19:55","","","","6","11/29/2016 08:19:55","",""
"2768","1713.0","PERBURUAN DAN PENANGKAPAN REPTIL","","KBLI 2015","11/29/2016 08:19:55","","","","6","11/29/2016 08:19:55","",""
"2769","1714.0","PERBURUAN DAN PENANGKAPAN BURUNG","","KBLI 2015","11/29/2016 08:19:55","","","","6","11/29/2016 08:19:55","",""
"2770","1715.0","PERBURUAN DAN PENANGKAPAN INSEKTA","","KBLI 2015","11/29/2016 08:19:55","","","","6","11/29/2016 08:19:55","",""
"2771","1719.0","PERBURUAN DAN PENANGKAPAN SATWA LIAR LAINNYA","","KBLI 2015","11/29/2016 08:19:55","","","","6","11/29/2016 08:19:55","",""
"2772","1721.0","PENANGKARAN PRIMATA","","KBLI 2015","11/29/2016 08:19:55","","","","6","11/29/2016 08:19:55","",""
"2773","1722.0","PENANGKARAN MAMALIA","","KBLI 2015","11/29/2016 08:19:55","","","","6","11/29/2016 08:19:55","",""
"2774","1723.0","PENANGKARAN REPTIL","","KBLI 2015","11/29/2016 08:19:55","","","","6","11/29/2016 08:19:55","",""
"2775","1724.0","PENANGKARAN BURUNG","","KBLI 2015","11/29/2016 08:19:55","","","","6","11/29/2016 08:19:55","",""
"2776","1725.0","PENANGKARAN INSEKTA","","KBLI 2015","11/29/2016 08:19:55","","","","6","11/29/2016 08:19:55","",""
"2777","1726.0","PENANGKARAN ANGGREK","","KBLI 2015","11/29/2016 08:19:55","","","","6","11/29/2016 08:19:55","",""
"2778","1727.0","PENANGKARAN IKAN DAN CORAL/KARANG","","KBLI 2015","11/29/2016 08:19:55","","","","6","11/29/2016 08:19:55","",""
"2779","1729.0","PENANGKARAN TUMBUHAN/SATWA LIAR LAINNYA","","KBLI 2015","11/29/2016 08:19:55","","","","6","11/29/2016 08:19:55","",""
"2780","1812.0","KEGIATAN JASA PENUNJANG PENCETAKAN","","KBLI 2015","11/29/2016 08:19:55","","","","6","11/29/2016 08:19:55","",""
"2781","18120.0","KEGIATAN JASA PENUNJANG PENCETAKAN","","KBLI 2015","11/29/2016 08:19:55","","","","6","11/29/2016 08:19:55","",""
"2782","1921.0","INDUSTRI BAHAN BAKAR DAN MINYAK PELUMAS HASIL PENGILANGAN MINYAK BUMI","","KBLI 2015","11/29/2016 08:19:55","","","","6","11/29/2016 08:19:55","",""
"2783","19211.0","INDUSTRI BAHAN BAKAR DARI PEMURNIAN DAN PENGILANGAN MINYAK BUMI","","KBLI 2015","11/29/2016 08:19:55","","","","6","11/29/2016 08:19:55","",""
"2784","19212.0","INDUSTRI PEMBUATAN MINYAK PELUMAS","","KBLI 2015","11/29/2016 08:19:55","","","","6","11/29/2016 08:19:55","",""
"2785","19213.0","INDUSTRI PENGOLAHAN KEMBALI MINYAK PELUMAS BEKAS","","KBLI 2015","11/29/2016 08:19:55","","","","6","11/29/2016 08:19:55","",""
"2786","1929.0","INDUSTRI PRODUK PENGILANGAN MINYAK BUMI LAINNYA","","KBLI 2015","11/29/2016 08:19:55","","","","6","11/29/2016 08:19:55","",""
"2787","20128.0","INDUSTRI MEDIA TANAM","","KBLI 2015","11/29/2016 08:19:55","","","","6","11/29/2016 08:19:55","",""
"2788","2101.0","INDUSTRI FARMASI DAN PRODUK OBAT KIMIA","","KBLI 2015","11/29/2016 08:19:55","","","","6","11/29/2016 08:19:55","",""
"2789","21012.0","INDUSTRI PRODUK FARMASI UNTUK MANUSIA","","KBLI 2015","11/29/2016 08:19:55","","","","6","11/29/2016 08:19:55","",""
"2790","21013.0","INDUSTRI PRODUK FARMASI UNTUK HEWAN","","KBLI 2015","11/29/2016 08:19:55","","","","6","11/29/2016 08:19:55","",""
"2791","2102.0","INDUSTRI OBAT TRADISIONAL","","KBLI 2015","11/29/2016 08:19:55","","","","6","11/29/2016 08:19:55","",""
"2792","21021.0","INDUSTRI BAHAN BAKU OBAT TRADISIONAL","","KBLI 2015","11/29/2016 08:19:55","","","","6","11/29/2016 08:19:55","",""
"2793","2115.0","PENGUSAHAAN HUTAN SENGON/ALBASIA/JEUNJING","","KBLI 2015","11/29/2016 08:19:55","","","","6","11/29/2016 08:19:55","",""
"2794","2141.0","PENGUSAHAAN PEMBIBITAN TANAMAN JATI","","KBLI 2015","11/29/2016 08:19:55","","","","6","11/29/2016 08:19:55","",""
"2795","2142.0","PENGUSAHAAN PEMBIBITAN TANAMAN PINUS","","KBLI 2015","11/29/2016 08:19:55","","","","6","11/29/2016 08:19:55","",""
"2796","2143.0","PENGUSAHAAN PEMBIBITAN TANAMAN MAHONI","","KBLI 2015","11/29/2016 08:19:55","","","","6","11/29/2016 08:19:55","",""
"2797","2144.0","PENGUSAHAAN PEMBIBITAN TANAMAN SONOKELING","","KBLI 2015","11/29/2016 08:19:55","","","","6","11/29/2016 08:19:55","",""
"2798","2145.0","PENGUSAHAAN PEMBIBITAN TANAMAN SENGON/ALBASIA/JEUNJING","","KBLI 2015","11/29/2016 08:19:55","","","","6","11/29/2016 08:19:55","",""
"2799","2146.0","PENGUSAHAAN PEMBIBITAN TANAMAN JABON","","KBLI 2015","11/29/2016 08:19:55","","","","6","11/29/2016 08:19:55","",""
"2800","2147.0","PENGUSAHAAN PEMBIBITAN TANAMAN AKASIA","","KBLI 2015","11/29/2016 08:19:55","","","","6","11/29/2016 08:19:55","",""
"2801","2148.0","PENGUSAHAAN PEMBIBITAN TANAMAN EKALIPTUS","","KBLI 2015","11/29/2016 08:19:55","","","","6","11/29/2016 08:19:55","",""
"2802","2149.0","PENGUSAHAAN PEMBIBITAN TANAMAN KEHUTANAN LAINNYA","","KBLI 2015","11/29/2016 08:19:55","","","","6","11/29/2016 08:19:55","",""
"2803","22.0","PEMANENAN DAN PEMUNGUTAN KAYU","","KBLI 2015","11/29/2016 08:19:55","","","","6","11/29/2016 08:19:55","",""
"2804","220.0","PEMANENAN DAN PEMUNGUTAN KAYU","","KBLI 2015","11/29/2016 08:19:55","","","","6","11/29/2016 08:19:55","",""
"2805","2201.0","PEMANENAN KAYU","","KBLI 2015","11/29/2016 08:19:55","","","","6","11/29/2016 08:19:55","",""
"2806","2212.0","INDUSTRI PENGASAPAN, REMILLING DAN KARET REMAH","","KBLI 2015","11/29/2016 08:19:55","","","","6","11/29/2016 08:19:55","",""
"2807","2219.0","INDUSTRI BARANG DARI KARET LAINNYA","","KBLI 2015","11/29/2016 08:19:55","","","","6","11/29/2016 08:19:55","",""
"2808","2221.0","INDUSTRI BARANG DARI PLASTIK UNTUK BANGUNAN","","KBLI 2015","11/29/2016 08:19:55","","","","6","11/29/2016 08:19:55","",""
"2809","2222.0","INDUSTRI BARANG DARI PLASTIK UNTUK PENGEMASAN","","KBLI 2015","11/29/2016 08:19:56","","","","6","11/29/2016 08:19:56","",""
"2810","2223.0","INDUSTRI PIPA PLASTIK DAN PERLENGKAPANNYA","","KBLI 2015","11/29/2016 08:19:56","","","","6","11/29/2016 08:19:56","",""
"2811","2229.0","INDUSTRI BARANG DARI PLASTIK LAINNYA","","KBLI 2015","11/29/2016 08:19:56","","","","6","11/29/2016 08:19:56","",""
"2812","2311.0","INDUSTRI KACA","","KBLI 2015","11/29/2016 08:19:56","","","","6","11/29/2016 08:19:56","",""
"2813","2312.0","INDUSTRI BARANG DARI KACA","","KBLI 2015","11/29/2016 08:19:56","","","","6","11/29/2016 08:19:56","",""
"2814","23911.0","INDUSTRI BATA, MORTAR, SEMEN, DAN SEJENISNYA YANG TAHAN API","","KBLI 2015","11/29/2016 08:19:56","","","","6","11/29/2016 08:19:56","",""
"2815","23963.0","INDUSTRI BARANG DARI BATU UNTUK KEPERLUAN RUMAH TANGGA, PAJANGAN, DAN BAHAN BANGUNAN","","KBLI 2015","11/29/2016 08:19:56","","","","6","11/29/2016 08:19:56","",""
"2816","2401.0","JASA PENGGUNAAN KAWASAN HUTAN DI LUAR SEKTOR KEHUTANAN","","KBLI 2015","11/29/2016 08:19:56","","","","6","11/29/2016 08:19:56","",""
"2817","2402.0","JASA PERLINDUNGAN HUTAN DAN KONSERVASI ALAM","","KBLI 2015","11/29/2016 08:19:56","","","","6","11/29/2016 08:19:56","",""
"2818","2403.0","JASA REHABILITASI DAN RESTORASI KEHUTANAN SOSIAL","","KBLI 2015","11/29/2016 08:19:56","","","","6","11/29/2016 08:19:56","",""
"2819","2404.0","JASA KEHUTANAN BIDANG PERENCANAAN KEHUTANAN","","KBLI 2015","11/29/2016 08:19:56","","","","6","11/29/2016 08:19:56","",""
"2820","2405.0","JASA SERTIFIKASI, INSPEKSI, DAN VERIFIKASI PRODUK KEHUTANAN","","KBLI 2015","11/29/2016 08:19:56","","","","6","11/29/2016 08:19:56","",""
"2821","2409.0","JASA PENUNJANG KEHUTANAN LAINNYA","","KBLI 2015","11/29/2016 08:19:56","","","","6","11/29/2016 08:19:56","",""
"2822","25120.0","INDUSTRI TANGKI, TANGKI AIR DAN WADAH DARI LOGAM","","","11/29/2016 08:19:56","","","","6","11/29/2016 08:19:56","",""
"2823","2594.0","INDUSTRI EMBER, KALENG, DRUM DAN WADAH SEJENIS DARI LOGAM","","KBLI 2015","11/29/2016 08:19:56","","","","6","11/29/2016 08:19:56","",""
"2824","2595.0","INDUSTRI BARANG DARI KAWAT DAN PAKU, MUR DAN BAUT, BUKAN KABEL LOGAM","","KBLI 2015","11/29/2016 08:19:56","","","","6","11/29/2016 08:19:56","",""
"2825","2595.0","INDUSTRI BARANG DARI KAWAT DAN PAKU, MUR DAN","","","11/29/2016 08:19:56","","","","6","11/29/2016 08:19:56","",""
"2826","2599.0","INDUSTRI BARANG LOGAM LAINNYA YTDL","","KBLI 2015","11/29/2016 08:19:56","","","","6","11/29/2016 08:19:56","",""
"2827","2611.0","INDUSTRI TABUNG ELEKTRON DAN KONEKTOR ELEKTRONIK","","KBLI 2015","11/29/2016 08:19:56","","","","6","11/29/2016 08:19:56","",""
"2828","2612.0","INDUSTRI SEMI KONDUKTOR DAN KOMPONEN ELEKTRONIK LAINNYA","","KBLI 2015","11/29/2016 08:19:56","","","","6","11/29/2016 08:19:56","",""
"2829","2621.0","INDUSTRI  KOMPUTER DAN/ATAU PERAKITAN COMPUTER","","KBLI 2015","11/29/2016 08:19:56","","","","6","11/29/2016 08:19:56","",""
"2830","2621.0","INDUSTRI KOMPUTER DAN/ATAU PERAKITAN COMPUTER","","","11/29/2016 08:19:56","","","","6","11/29/2016 08:19:56","",""
"2831","2622.0","INDUSTRI PERLENGKAPAN COMPUTER","","KBLI 2015","11/29/2016 08:19:56","","","","6","11/29/2016 08:19:56","",""
"2832","2631.0","INDUSTRI PERALATAN TELEPON DAN FAKSIMILI","","KBLI 2015","11/29/2016 08:19:56","","","","6","11/29/2016 08:19:56","",""
"2833","2632.0","INDUSTRI PERALATAN KOMUNIKASI TANPA KABEL (WIRELESS)","","KBLI 2015","11/29/2016 08:19:56","","","","6","11/29/2016 08:19:56","",""
"2834","2639.0","INDUSTRI PERALATAN KOMUNIKASI LAINNYA","","KBLI 2015","11/29/2016 08:19:56","","","","6","11/29/2016 08:19:56","",""
"2835","26391.0","INDUSTRI KARTU CERDAS (SMART CARD)","","KBLI 2015","11/29/2016 08:19:56","","","","6","11/29/2016 08:19:56","",""
"2836","26399.0","INDUSTRI PERALATAN KOMUNIKASI LAINNYA","","KBLI 2015","11/29/2016 08:19:56","","","","6","11/29/2016 08:19:56","",""
"2837","2641.0","INDUSTRI TELEVISI DAN/ATAU PERAKITAN TELEVISI","","KBLI 2015","11/29/2016 08:19:56","","","","6","11/29/2016 08:19:56","",""
"2838","2642.0","INDUSTRI PERALATAN PEREKAM, PENERIMA DAN PENGGANDA AUDIO DAN VIDEO, BUKAN INDUSTRI TELEVISI","","KBLI 2015","11/29/2016 08:19:56","","","","6","11/29/2016 08:19:56","",""
"2839","2649.0","INDUSTRI PERALATAN AUDIO DAN VIDEO ELEKTRONIK LAINNYA","","KBLI 2015","11/29/2016 08:19:56","","","","6","11/29/2016 08:19:56","",""
"2840","265.0","INDUSTRI ALAT UKUR, ALAT UJI, PERALATAN NAVIGASI DAN KONTROL DAN ALAT UKUR WAKTU","","KBLI 2015","11/29/2016 08:19:56","","","","6","11/29/2016 08:19:56","",""
"2841","2671.0","INDUSTRI PERALATAN FOTOGRAFI","","KBLI 2015","11/29/2016 08:19:56","","","","6","11/29/2016 08:19:56","",""
"2842","2679.0","INDUSTRI PERALATAN FOTOGRAFI DAN INSTRUMEN OPTIK LAINNYA","","KBLI 2015","11/29/2016 08:19:56","","","","6","11/29/2016 08:19:56","",""
"2843","2711.0","INDUSTRI MOTOR LISTRIK, GENERATOR DAN TRANSFORMATOR","","KBLI 2015","11/29/2016 08:19:56","","","","6","11/29/2016 08:19:56","",""
"2844","2712.0","INDUSTRI PERALATAN PENGONTROL DAN PENDISTRIBUSIAN LISTRIK","","KBLI 2015","11/29/2016 08:19:56","","","","6","11/29/2016 08:19:56","",""
"2845","27404.0","INDUSTRI LAMPU LED","","KBLI 2015","11/29/2016 08:19:56","","","","6","11/29/2016 08:19:56","",""
"2846","2751.0","INDUSTRI PERALATAN LISTRIK RUMAH TANGGA","","KBLI 2015","11/29/2016 08:19:56","","","","6","11/29/2016 08:19:56","",""
"2847","2752.0","INDUSTRI PERALATAN ELEKTROTERMAL RUMAH TANGGA","","KBLI 2015","11/29/2016 08:19:56","","","","6","11/29/2016 08:19:56","",""
"2848","2752.0","INDUSTRI PERALATAN","","","11/29/2016 08:19:56","","","","6","11/29/2016 08:19:56","",""
"2849","2753.0","INDUSTRI PERALATAN PEMANAS DAN MASAK BUKAN LISTRIK RUMAH TANGGA","","KBLI 2015","11/29/2016 08:19:56","","","","6","11/29/2016 08:19:56","",""
"2850","28120.0","INDUSTRI MESIN PERTANIAN DAN KEHUTANAN","","","11/29/2016 08:19:56","","","","6","11/29/2016 08:19:56","",""
"2851","28160.0","INDUSTRI ALAT PENGANGKUT DAN PEMINDAH","","","11/29/2016 08:19:56","","","","6","11/29/2016 08:19:56","",""
"2852","28221.0","INDUSTRI MESIN DAN PERKAKAS MESIN UNTUK PENGERJAAN LOGAM","","","11/29/2016 08:19:56","","","","6","11/29/2016 08:19:56","",""
"2853","28240.0","INDUSTRI MESIN PENAMBANGAN, PENGGALIAN, DAN KONSTRUKSI","","","11/29/2016 08:19:56","","","","6","11/29/2016 08:19:56","",""
"2854","29300.0","INDUSTRI SUKU CADANG DAN AKSESORI KENDARAAN BERMOTOR RODA EMPAT ATAU LEBIH","","","11/29/2016 08:19:56","","","","6","11/29/2016 08:19:56","",""
"2855","3011.0","INDUSTRI PEMBUATAN KAPAL, PERAHU DAN STRUKTUR BANGUNAN TERAPUNG","","KBLI 2015","11/29/2016 08:19:56","","","","6","11/29/2016 08:19:56","",""
"2856","3012.0","INDUSTRI PEMBUATAN KAPAL DAN PERAHU UNTUK TUJUAN WISATA ATAU REKREASI DAN OLAHRAGA","","KBLI 2015","11/29/2016 08:19:56","","","","6","11/29/2016 08:19:56","",""
"2857","30120.0","INDUSTRI PEMBUATAN KAPAL DAN PERAHU UNTUK TUJUAN WISATA ATAU REKREASI DAN OLAHRAGA","","KBLI 2015","11/29/2016 08:19:56","","","","6","11/29/2016 08:19:56","",""
"2858","3114.0","PENANGKAPAN/PENGAMBIL AN TUMBUHAN AIR DI LAUT","","KBLI 2015","11/29/2016 08:19:56","","","","6","11/29/2016 08:19:56","",""
"2859","3124.0","PENANGKAPAN/PENGAMBIL AN TUMBUHAN AIR DI PERAIRAN UMUM","","KBLI 2015","11/29/2016 08:19:56","","","","6","11/29/2016 08:19:56","",""
"2860","3125.0","PENANGKAPAN/PENGAMBIL AN INDUK/BENIH IKAN DI PERAIRAN UMUM","","KBLI 2015","11/29/2016 08:19:56","","","","6","11/29/2016 08:19:56","",""
"2861","3126.0","PENANGKAPAN IKAN HIAS DI PERAIRAN UMUM","","KBLI 2015","11/29/2016 08:19:56","","","","6","11/29/2016 08:19:56","",""
"2862","3211.0","PEMBESARAN PISCES/ IKAN BERSIRIP  LAUT","","KBLI 2015","11/29/2016 08:19:56","","","","6","11/29/2016 08:19:56","",""
"2863","3215.0","PEMBESARAN MOLLUSCA LAUT","","KBLI 2015","11/29/2016 08:19:56","","","","6","11/29/2016 08:19:56","",""
"2864","3216.0","PEMBESARAN CRUSTACEA LAUT","","KBLI 2015","11/29/2016 08:19:56","","","","6","11/29/2016 08:19:56","",""
"2865","3217.0","PEMBESARAN TUMBUHAN AIR LAUT","","KBLI 2015","11/29/2016 08:19:56","","","","6","11/29/2016 08:19:56","",""
"2866","3219.0","BUDIDAYA BIOTA AIR LAUT LAINNYA","","KBLI 2015","11/29/2016 08:19:56","","","","6","11/29/2016 08:19:56","",""
"2867","3229.0","BUDIDAYA IKAN AIR TAWAR DI MEDIA LAINNYA","","KBLI 2015","11/29/2016 08:19:56","","","","6","11/29/2016 08:19:56","",""
"2868","3251.0","PEMBESARAN PISCES/IKAN BERSIRIP AIR PAYAU","","KBLI 2015","11/29/2016 08:19:56","","","","6","11/29/2016 08:19:56","",""
"2869","3253.0","PEMBESARAN MOLLUSCA AIR PAYAU","","KBLI 2015","11/29/2016 08:19:56","","","","6","11/29/2016 08:19:56","",""
"2870","3254.0","PEMBESARAN CRUSTACEA AIR PAYAU","","KBLI 2015","11/29/2016 08:19:56","","","","6","11/29/2016 08:19:56","",""
"2871","3255.0","PEMBESARAN TUMBUHAN AIR PAYAU","","KBLI 2015","11/29/2016 08:19:56","","","","6","11/29/2016 08:19:56","",""
"2872","3259.0","BUDIDAYA BIOTA AIR PAYAU LAINNYA","","KBLI 2015","11/29/2016 08:19:56","","","","6","11/29/2016 08:19:56","",""
"2873","32905.0","INDUSTRI SERAT SABUT KELAPA","","KBLI 2015","11/29/2016 08:19:56","","","","6","11/29/2016 08:19:56","",""
"2874","33.0","REPARASI DAN PEMASANGAN MESIN DAN PERALATAN","","KBLI 2015","11/29/2016 08:19:56","","","","6","11/29/2016 08:19:56","",""
"2875","331.0","REPARASI PRODUK LOGAM PABRIKASI, MESIN DAN PERALATAN","","KBLI 2015","11/29/2016 08:19:56","","","","6","11/29/2016 08:19:56","",""
"2876","3311.0","REPARASI PRODUK LOGAM PABRIKASI","","KBLI 2015","11/29/2016 08:19:56","","","","6","11/29/2016 08:19:56","",""
"2877","33111.0","REPARASI PRODUK LOGAM SIAP PASANG UNTUK BANGUNAN, TANGKI, TANDON AIR DAN GENERATOR UAP","","KBLI 2015","11/29/2016 08:19:56","","","","6","11/29/2016 08:19:56","",""
"2878","33112.0","REPARASI PRODUK SENJATA DAN AMUNISI","","KBLI 2015","11/29/2016 08:19:56","","","","6","11/29/2016 08:19:56","",""
"2879","33119.0","REPARASI PRODUK LOGAM PABRIKASI LAINNYA","","KBLI 2015","11/29/2016 08:19:56","","","","6","11/29/2016 08:19:56","",""
"2880","3312.0","REPARASI MESIN","","KBLI 2015","11/29/2016 08:19:56","","","","6","11/29/2016 08:19:56","",""
"2881","33121.0","REPARASI MESIN UNTUK KEPERLUAN UMUM","","KBLI 2015","11/29/2016 08:19:56","","","","6","11/29/2016 08:19:56","",""
"2882","33122.0","REPARASI MESIN UNTUK KEPERLUAN KHUSUS","","KBLI 2015","11/29/2016 08:19:56","","","","6","11/29/2016 08:19:56","",""
"2883","3313.0","REPARASI PERALATAN ELEKTRONIK DAN OPTIK","","KBLI 2015","11/29/2016 08:19:56","","","","6","11/29/2016 08:19:56","",""
"2884","33131.0","REPARASI ALAT UKUR, ALAT UJI DAN PERALATAN NAVIGASI DAN PENGONTROL","","KBLI 2015","11/29/2016 08:19:56","","","","6","11/29/2016 08:19:56","",""
"2885","33132.0","REPARASI PERALATAN IRRADIASI, ELEKTROMEDIS DAN ELEKTROTHERAPI","","KBLI 2015","11/29/2016 08:19:56","","","","6","11/29/2016 08:19:56","",""
"2886","33133.0","REPARASI PERALATAN FOTOGRAFI DAN OPTIK","","KBLI 2015","11/29/2016 08:19:56","","","","6","11/29/2016 08:19:56","",""
"2887","3314.0","REPARASI PERALATAN LISTRIK","","KBLI 2015","11/29/2016 08:19:56","","","","6","11/29/2016 08:19:56","",""
"2888","33141.0","REPARASI MOTOR LISTRIK, GENERATOR DAN TRANSFORMATOR","","KBLI 2015","11/29/2016 08:19:56","","","","6","11/29/2016 08:19:56","",""
"2889","33142.0","REPARASI BATERAI DAN AKUMULATOR LISTRIK","","KBLI 2015","11/29/2016 08:19:56","","","","6","11/29/2016 08:19:56","",""
"2890","33149.0","REPARASI PERALATAN LISTRIK LAINNYA","","KBLI 2015","11/29/2016 08:19:56","","","","6","11/29/2016 08:19:56","",""
"2891","3315.0","REPARASI ALAT ANGKUTAN, BUKAN KENDARAAN BERMOTOR","","KBLI 2015","11/29/2016 08:19:56","","","","6","11/29/2016 08:19:56","",""
"2892","33151.0","REPARASI KAPAL, PERAHU DAN BANGUNAN TERAPUNG","","KBLI 2015","11/29/2016 08:19:56","","","","6","11/29/2016 08:19:56","",""
"2893","33152.0","REPARASI LOKOMOTIF DAN GERBONG KERETA","","KBLI 2015","11/29/2016 08:19:56","","","","6","11/29/2016 08:19:56","",""
"2894","33153.0","REPARASI PESAWAT TERBANG","","KBLI 2015","11/29/2016 08:19:56","","","","6","11/29/2016 08:19:56","",""
"2895","33159.0","REPARASI ALAT ANGKUTAN LAINNYA, BUKAN KENDARAAN BERMOTOR","","KBLI 2015","11/29/2016 08:19:56","","","","6","11/29/2016 08:19:56","",""
"2896","3319.0","REPARASI PERALATAN LAINNYA","","KBLI 2015","11/29/2016 08:19:56","","","","6","11/29/2016 08:19:56","",""
"2897","33190.0","REPARASI PERALATAN LAINNYA","","KBLI 2015","11/29/2016 08:19:56","","","","6","11/29/2016 08:19:56","",""
"2898","332.0","INSTALASI/PEMASANGAN MESIN DAN PERALATAN INDUSTRI","","KBLI 2015","11/29/2016 08:19:56","","","","6","11/29/2016 08:19:56","",""
"2899","3320.0","INSTALASI/PEMASANGAN MESIN DAN PERALATAN INDUSTRI","","KBLI 2015","11/29/2016 08:19:56","","","","6","11/29/2016 08:19:56","",""
"2900","33200.0","INSTALASI/PEMASANGAN MESIN DAN PERALATAN INDUSTRI","","KBLI 2015","11/29/2016 08:19:56","","","","6","11/29/2016 08:19:56","",""
"2901","35104.0","AKTIVITAS PENUNJANG KELISTRIKAN","","KBLI 2015","11/29/2016 08:19:56","","","","6","11/29/2016 08:19:56","",""
"2902","352.0","PENGADAAN DAN DISTRIBUSI GAS ALAM DAN BUATAN","","KBLI 2015","11/29/2016 08:19:56","","","","6","11/29/2016 08:19:56","",""
"2903","3520.0","PENGADAAN DAN DISTRIBUSI GAS ALAM DAN BUATAN","","KBLI 2015","11/29/2016 08:19:56","","","","6","11/29/2016 08:19:56","",""
"2904","35201.0","PENGADAAN GAS ALAM DAN BUATAN","","KBLI 2015","11/29/2016 08:19:56","","","","6","11/29/2016 08:19:56","",""
"2905","35203.0","PENGADAAN GAS BIO","","KBLI 2015","11/29/2016 08:19:56","","","","6","11/29/2016 08:19:56","",""
"2906","36.0","PENGELOLAAN AIR","","KBLI 2015","11/29/2016 08:19:56","","","","6","11/29/2016 08:19:56","",""
"2907","360.0","PENGELOLAAN AIR","","KBLI 2015","11/29/2016 08:19:56","","","","6","11/29/2016 08:19:56","",""
"2908","3600.0","PENGELOLAAN AIR","","KBLI 2015","11/29/2016 08:19:56","","","","6","11/29/2016 08:19:57","",""
"2909","36003.0","AKTIVITAS PENUNJANG PENGELOLAAN AIR","","KBLI 2015","11/29/2016 08:19:57","","","","6","11/29/2016 08:19:57","",""
"2910","37.0","PENGELOLAAN AIR LIMBAH","","KBLI 2015","11/29/2016 08:19:57","","","","6","11/29/2016 08:19:57","",""
"2911","370.0","PENGELOLAAN AIR LIMBAH","","KBLI 2015","11/29/2016 08:19:57","","","","6","11/29/2016 08:19:57","",""
"2912","3701.0","PENGUMPULAN AIR LIMBAH","","KBLI 2015","11/29/2016 08:19:57","","","","6","11/29/2016 08:19:57","",""
"2913","37011.0","PENGUMPULAN AIR LIMBAH TIDAK BERBAHAYA","","KBLI 2015","11/29/2016 08:19:57","","","","6","11/29/2016 08:19:57","",""
"2914","37012.0","PENGUMPULAN AIR LIMBAH BERBAHAYA","","KBLI 2015","11/29/2016 08:19:57","","","","6","11/29/2016 08:19:57","",""
"2915","3702.0","PENGELOLAAN DAN PEMBUANGAN AIR LIMBAH","","KBLI 2015","11/29/2016 08:19:57","","","","6","11/29/2016 08:19:57","",""
"2916","37021.0","PENGELOLAAN DAN PEMBUANGAN AIR LIMBAH TIDAK BERBAHAYA","","KBLI 2015","11/29/2016 08:19:57","","","","6","11/29/2016 08:19:57","",""
"2917","37022.0","PENGELOLAAN DAN PEMBUANGAN AIR LIMBAH BERBAHAYA","","KBLI 2015","11/29/2016 08:19:57","","","","6","11/29/2016 08:19:57","",""
"2918","38.0","PENGELOLAAN DAN DAUR ULANG SAMPAH","","KBLI 2015","11/29/2016 08:19:57","","","","6","11/29/2016 08:19:57","",""
"2919","3811.0","PENGUMPULAN SAMPAH TIDAK BERBAHAYA","","KBLI 2015","11/29/2016 08:19:57","","","","6","11/29/2016 08:19:57","",""
"2920","38110.0","PENGUMPULAN SAMPAH TIDAK BERBAHAYA","","KBLI 2015","11/29/2016 08:19:57","","","","6","11/29/2016 08:19:57","",""
"2921","3812.0","PENGUMPULAN SAMPAH BERBAHAYA","","KBLI 2015","11/29/2016 08:19:57","","","","6","11/29/2016 08:19:57","",""
"2922","38120.0","PENGUMPULAN SAMPAH BERBAHAYA","","KBLI 2015","11/29/2016 08:19:57","","","","6","11/29/2016 08:19:57","",""
"2923","382.0","PENGELOLAAN DAN PEMBUANGAN SAMPAH","","KBLI 2015","11/29/2016 08:19:57","","","","6","11/29/2016 08:19:57","",""
"2924","3821.0","PENGELOLAAN DAN PEMBUANGAN SAMPAH TIDAK BERBAHAYA","","KBLI 2015","11/29/2016 08:19:57","","","","6","11/29/2016 08:19:57","",""
"2925","38211.0","PENGELOLAAN DAN PEMBUANGAN SAMPAH TIDAK BERBAHAYA","","KBLI 2015","11/29/2016 08:19:57","","","","6","11/29/2016 08:19:57","",""
"2926","3822.0","PENGELOLAAN DAN PEMBUANGAN SAMPAH BERBAHAYA","","KBLI 2015","11/29/2016 08:19:57","","","","6","11/29/2016 08:19:57","",""
"2927","38220.0","PENGELOLAAN DAN PEMBUANGAN SAMPAH BERBAHAYA","","KBLI 2015","11/29/2016 08:19:57","","","","6","11/29/2016 08:19:57","",""
"2928","39.0","AKTIVITAS REMEDIASI DAN PENGELOLAAN SAMPAH LAINNYA","","KBLI 2015","11/29/2016 08:19:57","","","","6","11/29/2016 08:19:57","",""
"2929","390.0","AKTIVITAS REMEDIASI DAN PENGELOLAAN SAMPAH LAINNYA","","KBLI 2015","11/29/2016 08:19:57","","","","6","11/29/2016 08:19:57","",""
"2930","3900.0","AKTIVITAS REMEDIASI DAN PENGELOLAAN SAMPAH LAINNYA","","KBLI 2015","11/29/2016 08:19:57","","","","6","11/29/2016 08:19:57","",""
"2931","39000.0","AKTIVITAS REMEDIASI DAN PENGELOLAAN SAMPAH LAINNYA","","KBLI 2015","11/29/2016 08:19:57","","","","6","11/29/2016 08:19:57","",""
"2932","4101.0","KONSTRUKSI GEDUNG","","KBLI 2015","11/29/2016 08:19:57","","","","6","11/29/2016 08:19:57","",""
"2933","41018.0","KONSTRUKSI GEDUNG TEMPAT HIBURAN DAN OLAHRAGA","","KBLI 2015","11/29/2016 08:19:57","","","","6","11/29/2016 08:19:57","",""
"2934","4102.0","PEMASANGAN BANGUNAN PRAFABRIKASI UNTUK GEDUNG","","KBLI 2015","11/29/2016 08:19:57","","","","6","11/29/2016 08:19:57","",""
"2935","421.0","KONSTRUKSI JALAN DAN JALAN REL","","KBLI 2015","11/29/2016 08:19:57","","","","6","11/29/2016 08:19:57","",""
"2936","4211.0","KONSTRUKSI JALAN DAN JALAN REL","","KBLI 2015","11/29/2016 08:19:57","","","","6","11/29/2016 08:19:57","",""
"2937","42114.0","KONSTRUKSI JALAN REL DAN JEMBATAN REL","","KBLI 2015","11/29/2016 08:19:57","","","","6","11/29/2016 08:19:57","",""
"2938","4212.0","PEMASANGAN BANGUNAN PRAFABRIKASI UNTUK KONSTRUKSI JALAN DAN JALAN REL","","KBLI 2015","11/29/2016 08:19:57","","","","6","11/29/2016 08:19:57","",""
"2939","4221.0","KONSTRUKSI JARINGAN IRIGASI, KOMUNIKASI DAN LIMBAH","","KBLI 2015","11/29/2016 08:19:57","","","","6","11/29/2016 08:19:57","",""
"2940","4222.0","PEMASANGAN BANGUNAN PRAFABRIKASI UNTUK KONSTRUKSI JARINGAN SALURAN IRIGASI, KOMUNIKASI DAN LIMBAH","","KBLI 2015","11/29/2016 08:19:57","","","","6","11/29/2016 08:19:57","",""
"2941","4291.0","KONSTRUKSI BANGUNAN SIPIL LAINNYA","","KBLI 2015","11/29/2016 08:19:57","","","","6","11/29/2016 08:19:57","",""
"2942","4292.0","PEMASANGAN BANGUNAN PRAFABRIKASI UNTUK KONSTRUKSI BANGUNAN SIPIL LAINNYA","","KBLI 2015","11/29/2016 08:19:57","","","","6","11/29/2016 08:19:57","",""
"2943","4322.0","INSTALASI SALURAN AIR (PLAMBING), PEMANAS DAN PENDINGIN","","KBLI 2015","11/29/2016 08:19:57","","","","6","11/29/2016 08:19:57","",""
