"id","kode_kbli","nama_kbli","keterangan","versi","created_at","created_by_id","rejected_at","rejected_by_id","status","updated_at","verified_at","verified_by_id"
"807","17014","INDUSTRI KERTAS KHUSUS","","","11/29/2016 08:19:38","","","","6","11/29/2016 08:19:38","",""
"808","17019","INDUSTRI KERTAS LAINNYA","","","11/29/2016 08:19:38","","","","6","11/29/2016 08:19:38","",""
"809","1702","INDUSTRI KERTAS DAN PAPAN KERTAS BERGELOMBANG DAN WADAH DARI KERTAS DAN PAPAN KERTAS","","","11/29/2016 08:19:38","","","","6","11/29/2016 08:19:38","",""
"810","17021","INDUSTRI KERTAS DAN PAPAN KERTAS BERGELOMBANG","","","11/29/2016 08:19:38","","","","6","11/29/2016 08:19:38","",""
"811","17022","INDUSTRI KEMASAN DAN KOTAK DARI KERTAS DAN KARTON","","","11/29/2016 08:19:38","","","","6","11/29/2016 08:19:38","",""
"812","1709","INDUSTRI BARANG DARI KERTAS DAN PAPAN KERTAS LAINNYA","","","11/29/2016 08:19:38","","","","6","11/29/2016 08:19:38","",""
"813","17091","INDUSTRI KERTAS TISSUE","","","11/29/2016 08:19:38","","","","6","11/29/2016 08:19:38","",""
"814","17099","INDUSTRI BARANG DARI KERTAS DAN PAPAN KERTAS LAINNYA YTDL","","","11/29/2016 08:19:38","","","","6","11/29/2016 08:19:38","",""
"815","18","INDUSTRI PENCETAKAN DAN REPRODUKSI MEDIA REKAMAN","","","11/29/2016 08:19:38","","","","6","11/29/2016 08:19:38","",""
"816","181","INDUSTRI PENCETAKAN DAN KEGIATAN YBDI","","","11/29/2016 08:19:38","","","","6","11/29/2016 08:19:38","",""
"817","1811","INDUSTRI PENCETAKAN","","","11/29/2016 08:19:38","","","","6","11/29/2016 08:19:38","",""
"818","18111","INDUSTRI PENCETAKAN UMUM","","","11/29/2016 08:19:38","","","","6","11/29/2016 08:19:38","",""
"819","18112","INDUSTRI PENCETAKAN KHUSUS","","","11/29/2016 08:19:38","","","","6","11/29/2016 08:19:38","",""
"820","1812","KEGIATAN JASA PENUNJANG PENCETAKAN","","","11/29/2016 08:19:38","","","","6","11/29/2016 08:19:38","",""
"821","18120","KEGIATAN JASA PENUNJANG PENCETAKAN","","","11/29/2016 08:19:38","","","","6","11/29/2016 08:19:38","",""
"822","182","REPRODUKSI MEDIA REKAMAN","","","11/29/2016 08:19:38","","","","6","11/29/2016 08:19:38","",""
"823","1820","REPRODUKSI MEDIA REKAMAN","","","11/29/2016 08:19:38","","","","6","11/29/2016 08:19:38","",""
"824","18201","REPRODUKSI MEDIA REKAMAN SUARA DAN PIRANTI LUNAK","","","11/29/2016 08:19:38","","","","6","11/29/2016 08:19:38","",""
"825","18202","REPRODUKSI MEDIA REKAMAN FILM DAN VIDEO","","","11/29/2016 08:19:38","","","","6","11/29/2016 08:19:38","",""
"826","19","INDUSTRI PRODUK DARI BATU BARA DAN PENGILANGAN MINYAK BUMI","","","11/29/2016 08:19:38","","","","6","11/29/2016 08:19:38","",""
"827","191","INDUSTRI PRODUK DARI BATU BARA","","","11/29/2016 08:19:38","","","","6","11/29/2016 08:19:38","",""
"828","1910","INDUSTRI PRODUK DARI BATU BARA","","","11/29/2016 08:19:38","","","","6","11/29/2016 08:19:38","",""
"829","19100","INDUSTRI PRODUK DARI BATU BARA","","","11/29/2016 08:19:38","","","","6","11/29/2016 08:19:38","",""
"830","192","INDUSTRI PRODUK PENGILANGAN MINYAK BUMI","","","11/29/2016 08:19:38","","","","6","11/29/2016 08:19:38","",""
"831","1921","INDUSTRI BAHAN BAKAR DAN MINYAK PELUMAS HASIL PENGILANGAN MINYAK BUMI","","","11/29/2016 08:19:38","","","","6","11/29/2016 08:19:38","",""
"832","19211","INDUSTRI BAHAN BAKAR DARI PEMURNIAN DAN PENGILANGAN MINYAK BUMI","","","11/29/2016 08:19:38","","","","6","11/29/2016 08:19:38","",""
"833","19212","INDUSTRI PEMBUATAN MINYAK PELUMAS","","","11/29/2016 08:19:38","","","","6","11/29/2016 08:19:38","",""
"834","19213","INDUSTRI PENGOLAHAN KEMBALI MINYAK PELUMAS BEKAS","","","11/29/2016 08:19:38","","","","6","11/29/2016 08:19:38","",""
"835","1929","INDUSTRI PRODUK PENGILANGAN MINYAK BUMI LAINNYA","","","11/29/2016 08:19:38","","","","6","11/29/2016 08:19:38","",""
"836","19291","INDUSTRI PRODUK DARI HASIL KILANG MINYAK BUMI","","","11/29/2016 08:19:38","","","","6","11/29/2016 08:19:38","",""
"837","19292","INDUSTRI BRIKET BATU BARA","","","11/29/2016 08:19:38","","","","6","11/29/2016 08:19:38","",""
"838","20","INDUSTRI BAHAN KIMIA DAN BARANG DARI BAHAN KIMIA","","","11/29/2016 08:19:38","","","","6","11/29/2016 08:19:38","",""
"839","201","INDUSTRI BAHAN KIMIA","","","11/29/2016 08:19:38","","","","6","11/29/2016 08:19:38","",""
"840","2011","INDUSTRI KIMIA DASAR","","","11/29/2016 08:19:38","","","","6","11/29/2016 08:19:38","",""
"841","20111","INDUSTRI KIMIA DASAR ANORGANIK KHLOR DAN ALKALI","","","11/29/2016 08:19:38","","","","6","11/29/2016 08:19:38","",""
"842","20112","INDUSTRI KIMIA DASAR ANORGANIK GAS INDUSTRI","","","11/29/2016 08:19:38","","","","6","11/29/2016 08:19:38","",""
"843","20113","INDUSTRI KIMIA DASAR ANORGANIK PIGMEN","","","11/29/2016 08:19:38","","","","6","11/29/2016 08:19:38","",""
"844","20114","INDUSTRI KIMIA DASAR ANORGANIK LAINNYA","","","11/29/2016 08:19:38","","","","6","11/29/2016 08:19:38","",""
"845","20115","INDUSTRI KIMIA DASAR ORGANIK YANG BERSUMBER DARI HASIL PERTANIAN","","","11/29/2016 08:19:38","","","","6","11/29/2016 08:19:38","",""
"846","20116","INDUSTRI KIMIA DASAR ORGANIK UNTUK BAHAN BAKU ZAT WARNA DAN PIGMEN,ZAT WARNA DAN PIGMEN","","","11/29/2016 08:19:38","","","","6","11/29/2016 08:19:38","",""
"847","20117","INDUSTRI KIMIA DASAR ORGANIK YANG BERSUMBER DARI MINYAK BUMI, GAS ALAM DAN BATU BARA","","","11/29/2016 08:19:38","","","","6","11/29/2016 08:19:38","",""
"848","20118","INDUSTRI KIMIA DASAR ORGANIK YANG MENGHASILKAN BAHAN KIMIA KHUSUS","","","11/29/2016 08:19:38","","","","6","11/29/2016 08:19:38","",""
"849","20119","INDUSTRI KIMIA DASAR ORGANIK LAINNYA","","","11/29/2016 08:19:38","","","","6","11/29/2016 08:19:38","",""
"850","2012","INDUSTRI PUPUK DAN BAHAN SENYAWA NITROGEN","","","11/29/2016 08:19:38","","","","6","11/29/2016 08:19:38","",""
"851","20121","INDUSTRI PUPUK ALAM/NON SINTETIS HARA MAKRO PRIMER","","","11/29/2016 08:19:38","","","","6","11/29/2016 08:19:38","",""
"852","20122","INDUSTRI PUPUK BUATAN TUNGGAL HARA MAKRO PRIMER","","","11/29/2016 08:19:38","","","","6","11/29/2016 08:19:38","",""
"853","20123","INDUSTRI PUPUK BUATAN MAJEMUK HARA MAKRO PRIMER","","","11/29/2016 08:19:38","","","","6","11/29/2016 08:19:38","",""
"854","20124","INDUSTRI PUPUK BUATAN CAMPURAN HARA MAKRO PRIMER","","","11/29/2016 08:19:38","","","","6","11/29/2016 08:19:38","",""
"855","20125","INDUSTRI PUPUK HARA MAKRO SEKUNDER","","","11/29/2016 08:19:38","","","","6","11/29/2016 08:19:38","",""
"856","20126","INDUSTRI PUPUK HARA MIKRO","","","11/29/2016 08:19:38","","","","6","11/29/2016 08:19:38","",""
"857","20127","INDUSTRI PUPUK PELENGKAP","","","11/29/2016 08:19:38","","","","6","11/29/2016 08:19:38","",""
"858","20128","INDUSTRI MEDIA TANAM","","","11/29/2016 08:19:38","","","","6","11/29/2016 08:19:38","",""
"859","20129","INDUSTRI PUPUK LAINNYA","","","11/29/2016 08:19:38","","","","6","11/29/2016 08:19:38","",""
"860","2013","INDUSTRI PLASTIK DAN KARET BUATAN DALAM BENTUK DASAR","","","11/29/2016 08:19:38","","","","6","11/29/2016 08:19:38","",""
"861","20131","INDUSTRI DAMAR BUATAN (RESIN SINTETIS) DAN BAHAN BAKU PLASTIK","","","11/29/2016 08:19:38","","","","6","11/29/2016 08:19:38","",""
"862","20132","INDUSTRI KARET BUATAN","","","11/29/2016 08:19:38","","","","6","11/29/2016 08:19:38","",""
"863","202","INDUSTRI BARANG KIMIA LAINNYA","","","11/29/2016 08:19:38","","","","6","11/29/2016 08:19:38","",""
"864","2021","INDUSTRI PESTISIDA DAN PRODUK AGROKIMIA LAINNYA","","","11/29/2016 08:19:38","","","","6","11/29/2016 08:19:38","",""
"865","20211","INDUSTRI BAHAN BAKU PEMBERANTAS HAMA (BAHAN AKTIF)","","","11/29/2016 08:19:38","","","","6","11/29/2016 08:19:38","",""
"866","20212","INDUSTRI PEMBERANTAS HAMA (FORMULASI)","","","11/29/2016 08:19:38","","","","6","11/29/2016 08:19:38","",""
"867","20213","INDUSTRI ZAT PENGATUR TUMBUH","","","11/29/2016 08:19:38","","","","6","11/29/2016 08:19:38","",""
"868","20214","INDUSTRI BAHAN AMELIORAN (PEMBENAH TANAH)","","","11/29/2016 08:19:38","","","","6","11/29/2016 08:19:38","",""
"869","2022","INDUSTRI CAT DAN TINTA CETAK, PERNIS DAN BAHAN PELAPISAN SEJENISNYA DAN LAK","","","11/29/2016 08:19:38","","","","6","11/29/2016 08:19:38","",""
"870","20221","INDUSTRI CAT DAN TINTA CETAK","","","11/29/2016 08:19:38","","","","6","11/29/2016 08:19:38","",""
"871","20222","INDUSTRI PERNIS (TERMASUK MASTIK)","","","11/29/2016 08:19:38","","","","6","11/29/2016 08:19:38","",""
"872","20223","INDUSTRI LAK","","","11/29/2016 08:19:38","","","","6","11/29/2016 08:19:38","",""
"873","2023","INDUSTRI SABUN DAN DETERJEN, BAHAN PEMBERSIH DAN PENGILAP, PARFUM DAN KOSMETIK","","","11/29/2016 08:19:38","","","","6","11/29/2016 08:19:38","",""
"874","20231","INDUSTRI SABUN DAN BAHAN PEMBERSIH KEPERLUAN RUMAH TANGGA","","","11/29/2016 08:19:38","","","","6","11/29/2016 08:19:38","",""
"875","20232","INDUSTRI KOSMETIK, TERMASUK PASTA GIG","","","11/29/2016 08:19:38","","","","6","11/29/2016 08:19:38","",""
"876","2029","INDUSTRI BARANG KIMIA LAINNYA YTDL","","","11/29/2016 08:19:38","","","","6","11/29/2016 08:19:38","",""
"877","20291","INDUSTRI PEREKAT/LEM","","","11/29/2016 08:19:38","","","","6","11/29/2016 08:19:38","",""
"878","20292","INDUSTRI BAHAN PELEDAK","","","11/29/2016 08:19:38","","","","6","11/29/2016 08:19:38","",""
"879","20293","INDUSTRI TINTA","","","11/29/2016 08:19:38","","","","6","11/29/2016 08:19:38","",""
"880","20294","INDUSTRI MINYAK ATSIRI","","","11/29/2016 08:19:38","","","","6","11/29/2016 08:19:38","",""
"881","20295","INDUSTRI KOREK API","","","11/29/2016 08:19:38","","","","6","11/29/2016 08:19:38","",""
"882","20299","INDUSTRI BARANG KIMIA LAINNYA YTDL","","","11/29/2016 08:19:38","","","","6","11/29/2016 08:19:38","",""
"883","203","INDUSTRI SERAT BUATAN","","","11/29/2016 08:19:38","","","","6","11/29/2016 08:19:38","",""
"884","2030","INDUSTRI SERAT BUATAN","","","11/29/2016 08:19:38","","","","6","11/29/2016 08:19:38","",""
"885","20301","INDUSTRI SERAT/BENANG/STRIP FILAMEN BUATAN","","","11/29/2016 08:19:38","","","","6","11/29/2016 08:19:38","",""
"886","20302","INDUSTRI SERAT STAPEL BUATAN","","","11/29/2016 08:19:38","","","","6","11/29/2016 08:19:38","",""
"887","21","INDUSTRI FARMASI, PRODUK OBAT KIMIA DAN OBAT TRADISIONAL","","","11/29/2016 08:19:38","","","","6","11/29/2016 08:19:38","",""
"888","210","INDUSTRI FARMASI, PRODUK OBAT KIMIA DAN OBAT TRADISIONAL","","","11/29/2016 08:19:38","","","","6","11/29/2016 08:19:38","",""
"889","2101","INDUSTRI FARMASI DAN PRODUK OBAT KIMIA","","","11/29/2016 08:19:38","","","","6","11/29/2016 08:19:38","",""
"890","21011","INDUSTRI BAHAN FARMASI","","","11/29/2016 08:19:38","","","","6","11/29/2016 08:19:38","",""
"891","21012","INDUSTRI PRODUK FARMASI UNTUK MANUSIA","","","11/29/2016 08:19:38","","","","6","11/29/2016 08:19:38","",""
"892","21013","INDUSTRI PRODUK FARMASI UNTUK HEWAN","","","11/29/2016 08:19:38","","","","6","11/29/2016 08:19:38","",""
"893","2102","INDUSTRI OBAT TRADISIONAL","","","11/29/2016 08:19:38","","","","6","11/29/2016 08:19:38","",""
"894","21021","INDUSTRI BAHAN BAKU OBAT TRADISIONAL","","","11/29/2016 08:19:38","","","","6","11/29/2016 08:19:38","",""
"895","21022","INDUSTRI PRODUK OBAT TRADISIONAL","","","11/29/2016 08:19:38","","","","6","11/29/2016 08:19:38","",""
"896","22","INDUSTRI KARET, BARANG DARI KARET DAN PLASTIK","","","11/29/2016 08:19:38","","","","6","11/29/2016 08:19:38","",""
"897","221","INDUSTRI KARET DAN BARANG DARI KARET","","","11/29/2016 08:19:38","","","","6","11/29/2016 08:19:38","",""
"898","2211","INDUSTRI BAN DAN VULKANISIR BAN","","","11/29/2016 08:19:38","","","","6","11/29/2016 08:19:38","",""
"899","22111","INDUSTRI BAN LUAR DAN BAN DALAM","","","11/29/2016 08:19:38","","","","6","11/29/2016 08:19:38","",""
"900","22112","INDUSTRI VULKANISIR BAN","","","11/29/2016 08:19:38","","","","6","11/29/2016 08:19:38","",""
"901","2212","INDUSTRI PENGASAPAN, REMILLING DAN KARET REMAH","","","11/29/2016 08:19:38","","","","6","11/29/2016 08:19:38","",""
"902","22121","INDUSTRI PENGASAPAN KARET","","","11/29/2016 08:19:38","","","","6","11/29/2016 08:19:38","",""
"903","22122","INDUSTRI REMILLING KARET","","","11/29/2016 08:19:38","","","","6","11/29/2016 08:19:38","",""
"904","22123","INDUSTRI KARET REMAH (CRUMB RUBBER)","","","11/29/2016 08:19:38","","","","6","11/29/2016 08:19:38","",""
"905","2219","INDUSTRI BARANG DARI KARET LAINNYA","","","11/29/2016 08:19:38","","","","6","11/29/2016 08:19:38","",""
"906","22191","INDUSTRI BARANG DARI KARET UNTUK KEPERLUAN RUMAH TANGGA","","","11/29/2016 08:19:38","","","","6","11/29/2016 08:19:38","",""
"907","22192","INDUSTRI BARANG DARI KARET UNTUK KEPERLUAN INDUSTRI","","","11/29/2016 08:19:38","","","","6","11/29/2016 08:19:38","",""
"908","22199","INDUSTRI BARANG DARI KARET LAINNYA YTDL","","","11/29/2016 08:19:38","","","","6","11/29/2016 08:19:38","",""
"909","222","INDUSTRI BARANG DARI PLASTIK","","","11/29/2016 08:19:38","","","","6","11/29/2016 08:19:38","",""
"910","2221","INDUSTRI BARANG DARI PLASTIK UNTUK BANGUNAN","","","11/29/2016 08:19:38","","","","6","11/29/2016 08:19:38","",""
"911","22210","INDUSTRI BARANG DARI PLASTIK UNTUK BANGUNAN","","","11/29/2016 08:19:38","","","","6","11/29/2016 08:19:39","",""
"912","2222","INDUSTRI BARANG DARI PLASTIK UNTUK PENGEMASAN","","","11/29/2016 08:19:39","","","","6","11/29/2016 08:19:39","",""
"913","22220","INDUSTRI BARANG DARI PLASTIK UNTUK PENGEMASAN","","","11/29/2016 08:19:39","","","","6","11/29/2016 08:19:39","",""
"914","2223","INDUSTRI PIPA PLASTIK DAN PERLENGKAPANNYA","","","11/29/2016 08:19:39","","","","6","11/29/2016 08:19:39","",""
"915","22230","INDUSTRI PIPA PLASTIK DAN PERLENGKAPANNYA","","","11/29/2016 08:19:39","","","","6","11/29/2016 08:19:39","",""
"916","2229","INDUSTRI BARANG DARI PLASTIK LAINNYA","","","11/29/2016 08:19:39","","","","6","11/29/2016 08:19:39","",""
"917","22291","INDUSTRI BARANG PLASTIK LEMBARAN","","","11/29/2016 08:19:39","","","","6","11/29/2016 08:19:39","",""
"918","22292","INDUSTRI PERLENGKAPAN DAN PERALATAN RUMAH TANGGA (TIDAK TERMASUK FURNITUR)","","","11/29/2016 08:19:39","","","","6","11/29/2016 08:19:39","",""
"919","22293","INDUSTRI BARANG DAN PERALATAN TEKNIK/INDUSTRI DARI PLASTIK","","","11/29/2016 08:19:39","","","","6","11/29/2016 08:19:39","",""
"920","22299","INDUSTRI BARANG PLASTIK LAINNYA YTDL","","","11/29/2016 08:19:39","","","","6","11/29/2016 08:19:39","",""
"921","23","INDUSTRI BARANG GALIAN BUKAN LOGAM","","","11/29/2016 08:19:39","","","","6","11/29/2016 08:19:39","",""
"922","231","INDUSTRI KACA DAN BARANG DARI KACA","","","11/29/2016 08:19:39","","","","6","11/29/2016 08:19:39","",""
"923","2311","INDUSTRI KACA","","","11/29/2016 08:19:39","","","","6","11/29/2016 08:19:39","",""
"924","23111","INDUSTRI KACA LEMBARAN","","","11/29/2016 08:19:39","","","","6","11/29/2016 08:19:39","",""
"925","23112","INDUSTRI KACA PENGAMAN","","","11/29/2016 08:19:39","","","","6","11/29/2016 08:19:39","",""
"926","23119","INDUSTRI KACA LAINNYA","","","11/29/2016 08:19:39","","","","6","11/29/2016 08:19:39","",""
"927","2312","INDUSTRI BARANG DARI KACA","","","11/29/2016 08:19:39","","","","6","11/29/2016 08:19:39","",""
"928","23121","INDUSTRI PERLENGKAPAN DAN PERALATAN RUMAH TANGGA DARI KACA","","","11/29/2016 08:19:39","","","","6","11/29/2016 08:19:39","",""
"929","23122","INDUSTRI ALAT-ALAT LABORATORIUM, FARMASI DAN KESEHATAN DARI KACA","","","11/29/2016 08:19:39","","","","6","11/29/2016 08:19:39","",""
"930","23123","INDUSTRI KEMASAN DARI KACA","","","11/29/2016 08:19:39","","","","6","11/29/2016 08:19:39","",""
"931","23129","INDUSTRI BARANG LAINNYA DARI KACA","","","11/29/2016 08:19:39","","","","6","11/29/2016 08:19:39","",""
"932","239","INDUSTRI BARANG GALIAN BUKAN LOGAM LAINNYA","","","11/29/2016 08:19:39","","","","6","11/29/2016 08:19:39","",""
"933","2391","INDUSTRI BARANG REFRAKTORI (TAHAN API)","","","11/29/2016 08:19:39","","","","6","11/29/2016 08:19:39","",""
"934","23911","INDUSTRI BATA, MORTAR, SEMEN, DAN SEJENISNYA YANG TAHAN API","","","11/29/2016 08:19:39","","","","6","11/29/2016 08:19:39","",""
"935","23919","INDUSTRI BARANG TAHAN API DARI TANAH LIAT/KERAMIK LAINNYA","","","11/29/2016 08:19:39","","","","6","11/29/2016 08:19:39","",""
"936","2392","INDUSTRI BAHAN BANGUNAN DARI TANAH LIAT/KERAMIK","","","11/29/2016 08:19:39","","","","6","11/29/2016 08:19:39","",""
"937","23921","INDUSTRI BATU BATA DARI TANAH LIAT/KERAMIK","","","11/29/2016 08:19:39","","","","6","11/29/2016 08:19:39","",""
"938","23922","INDUSTRI GENTENG DARI TANAH LIAT/KERAMIK","","","11/29/2016 08:19:39","","","","6","11/29/2016 08:19:39","",""
"939","23923","INDUSTRI PERALATAN SANITER DARI PORSELEN","","","11/29/2016 08:19:39","","","","6","11/29/2016 08:19:39","",""
"940","23929","INDUSTRI BAHAN BANGUNAN DARI TANAH LIAT/KERAMIK BUKAN BATU BATA DAN GENTENG","","","11/29/2016 08:19:39","","","","6","11/29/2016 08:19:39","",""
"941","2393","INDUSTRI BARANG TANAH LIAT/KERAMIK DAN PORSELEN BUKAN BAHAN BANGUNAN","","","11/29/2016 08:19:39","","","","6","11/29/2016 08:19:39","",""
"942","23931","INDUSTRI PERLENGKAPAN RUMAH TANGGA DARI PORSELEN","","","11/29/2016 08:19:39","","","","6","11/29/2016 08:19:39","",""
"943","23932","INDUSTRI PERLENGKAPAN RUMAH TANGGA DARI TANAH LIAT/KERAMIK","","","11/29/2016 08:19:39","","","","6","11/29/2016 08:19:39","",""
"944","23933","INDUSTRI ALAT LABORATORIUM DAN ALAT LISTRIK/TEKNIK DARI PORSELEN","","","11/29/2016 08:19:39","","","","6","11/29/2016 08:19:39","",""
"945","23939","INDUSTRI BARANG TANAH LIAT/KERAMIK DAN PORSELEN LAINNYA BUKAN BAHAN BANGUNAN","","","11/29/2016 08:19:39","","","","6","11/29/2016 08:19:39","",""
"946","2394","INDUSTRI SEMEN, KAPUR DAN GIPS","","","11/29/2016 08:19:39","","","","6","11/29/2016 08:19:39","",""
"947","23941","INDUSTRI SEMEN","","","11/29/2016 08:19:39","","","","6","11/29/2016 08:19:39","",""
"948","23942","INDUSTRI KAPUR","","","11/29/2016 08:19:39","","","","6","11/29/2016 08:19:39","",""
"949","23943","INDUSTRI GIPS","","","11/29/2016 08:19:39","","","","6","11/29/2016 08:19:39","",""
"950","2395","INDUSTRI BARANG DARI SEMEN, KAPUR, GIPS DAN ASBES","","","11/29/2016 08:19:39","","","","6","11/29/2016 08:19:39","",""
"951","23951","INDUSTRI BARANG DARI SEMEN","","","11/29/2016 08:19:39","","","","6","11/29/2016 08:19:39","",""
"952","23952","INDUSTRI BARANG DARI KAPUR","","","11/29/2016 08:19:39","","","","6","11/29/2016 08:19:39","",""
"953","23953","INDUSTRI BARANG DARI SEMEN DAN KAPUR UNTUK KONSTRUKSI","","","11/29/2016 08:19:39","","","","6","11/29/2016 08:19:39","",""
"954","23954","INDUSTRI BARANG DARI GIPS UNTUK KONSTRUKSI","","","11/29/2016 08:19:39","","","","6","11/29/2016 08:19:39","",""
"955","23955","INDUSTRI BARANG DARI ASBES UNTUK KEPERLUAN BAHAN BANGUNAN","","","11/29/2016 08:19:39","","","","6","11/29/2016 08:19:39","",""
"956","23956","INDUSTRI BARANG DARI ASBES UNTUK KEPERLUAN INDUSTRI","","","11/29/2016 08:19:39","","","","6","11/29/2016 08:19:39","",""
"957","23957","INDUSTRI MORTAR ATAU BETON SIAP PAKAI","","","11/29/2016 08:19:39","","","","6","11/29/2016 08:19:39","",""
"958","23959","INDUSTRI BARANG DARI SEMEN, KAPUR, GIPS DAN ASBES LAINNYA","","","11/29/2016 08:19:39","","","","6","11/29/2016 08:19:39","",""
"959","2396","INDUSTRI BARANG DARI BATU","","","11/29/2016 08:19:39","","","","6","11/29/2016 08:19:39","",""
"960","23961","INDUSTRI BARANG DARI MARMER DAN GRANIT UNTUK KEPERLUAN RUMAH TANGGA DAN PAJANGAN","","","11/29/2016 08:19:39","","","","6","11/29/2016 08:19:39","",""
"961","23962","INDUSTRI BARANG DARI MARMER DAN GRANIT UNTUK KEPERLUAN BAHAN BANGUNAN","","","11/29/2016 08:19:39","","","","6","11/29/2016 08:19:39","",""
"962","23963","INDUSTRI BARANG DARI BATU UNTUK KEPERLUAN RUMAH TANGGA, PAJANGAN, DAN BAHAN BANGUNAN","","","11/29/2016 08:19:39","","","","6","11/29/2016 08:19:39","",""
"963","23969","INDUSTRI BARANG DARI MARMER, GRANIT DAN BATU LAINNYA","","","11/29/2016 08:19:39","","","","6","11/29/2016 08:19:39","",""
"964","2399","INDUSTRI BARANG GALIAN BUKAN LOGAM LAINNYA YTDL","","","11/29/2016 08:19:39","","","","6","11/29/2016 08:19:39","",""
"965","23990","INDUSTRI BARANG GALIAN BUKAN LOGAM LAINNYA YTDL","","","11/29/2016 08:19:39","","","","6","11/29/2016 08:19:39","",""
"966","24","INDUSTRI LOGAM DASAR","","","11/29/2016 08:19:39","","","","6","11/29/2016 08:19:39","",""
"967","241","INDUSTRI LOGAM DASAR BESI DAN BAJA","","","11/29/2016 08:19:39","","","","6","11/29/2016 08:19:39","",""
"968","2410","INDUSTRI LOGAM DASAR BESI DAN BAJA","","","11/29/2016 08:19:39","","","","6","11/29/2016 08:19:39","",""
"969","24101","INDUSTRI BESI DAN BAJA DASAR (IRON AND STEEL MAKING)","","","11/29/2016 08:19:39","","","","6","11/29/2016 08:19:39","",""
"970","24102","INDUSTRI PENGGILINGAN BAJA (STEEL ROLLING)","","","11/29/2016 08:19:39","","","","6","11/29/2016 08:19:39","",""
"971","24103","INDUSTRI PIPA DAN SAMBUNGAN PIPA DARI BAJA DAN BESI","","","11/29/2016 08:19:39","","","","6","11/29/2016 08:19:39","",""
"972","242","INDUSTRI LOGAM DASAR MULIA DAN LOGAM DASAR BUKAN BESI LAINNYA","","","11/29/2016 08:19:39","","","","6","11/29/2016 08:19:39","",""
"973","2420","INDUSTRI LOGAM DASAR MULIA DAN LOGAM DASAR BUKAN BESI LAINNYA","","","11/29/2016 08:19:39","","","","6","11/29/2016 08:19:39","",""
"974","24201","INDUSTRI PEMBUATAN LOGAM DASAR MULIA","","","11/29/2016 08:19:39","","","","6","11/29/2016 08:19:39","",""
"975","24202","INDUSTRI PEMBUATAN LOGAM DASAR BUKAN BESI","","","11/29/2016 08:19:39","","","","6","11/29/2016 08:19:39","",""
"976","24203","INDUSTRI PENGGILINGAN LOGAM BUKAN BESI","","","11/29/2016 08:19:39","","","","6","11/29/2016 08:19:39","",""
"977","24204","INDUSTRI EKSTRUSI LOGAM BUKAN BESI","","","11/29/2016 08:19:39","","","","6","11/29/2016 08:19:39","",""
"978","24205","INDUSTRI PIPA DAN SAMBUNGAN PIPA DARI LOGAM BUKAN BESI DAN BAJA","","","11/29/2016 08:19:39","","","","6","11/29/2016 08:19:39","",""
"979","24206","INDUSTRI PENGOLAHAN URANIUM DAN BIJIH URANIUM","","","11/29/2016 08:19:39","","","","6","11/29/2016 08:19:39","",""
"980","243","INDUSTRI PENGECORAN LOGAM","","","11/29/2016 08:19:39","","","","6","11/29/2016 08:19:39","",""
"981","2431","INDUSTRI PENGECORAN BESI DAN BAJA","","","11/29/2016 08:19:39","","","","6","11/29/2016 08:19:39","",""
"982","24310","INDUSTRI PENGECORAN BESI DAN BAJA","","","11/29/2016 08:19:39","","","","6","11/29/2016 08:19:39","",""
"983","2432","INDUSTRI PENGECORAN LOGAM BUKAN BESI DAN BAJA","","","11/29/2016 08:19:39","","","","6","11/29/2016 08:19:39","",""
"984","24320","INDUSTRI PENGECORAN LOGAM BUKAN BESI DAN BAJA","","","11/29/2016 08:19:39","","","","6","11/29/2016 08:19:39","",""
"985","25","INDUSTRI BARANG LOGAM, BUKAN MESIN DAN PERALATANNYA","","","11/29/2016 08:19:39","","","","6","11/29/2016 08:19:39","",""
"986","251","INDUSTRI BARANG LOGAM SIAP PASANG UNTUK BANGUNAN, TANGKI, TANDON AIR DAN GENERATOR UAP","","","11/29/2016 08:19:39","","","","6","11/29/2016 08:19:39","",""
"987","2511","INDUSTRI BARANG LOGAM SIAP PASANG UNTUK BANGUNAN","","","11/29/2016 08:19:39","","","","6","11/29/2016 08:19:39","",""
"988","25111","INDUSTRI BARANG DARI LOGAM BUKAN ALUMINIUM SIAP PASANG UNTUK BANGUNAN","","","11/29/2016 08:19:39","","","","6","11/29/2016 08:19:39","",""
"989","25112","INDUSTRI BARANG DARI LOGAM ALUMINIUM SIAP PASANG UNTUK BANGUNAN","","","11/29/2016 08:19:39","","","","6","11/29/2016 08:19:39","",""
"990","25113","INDUSTRI KONSTRUKSI BERAT SIAP PASANG DARI BAJA UNTUK BANGUNAN","","","11/29/2016 08:19:39","","","","6","11/29/2016 08:19:39","",""
"991","25119","INDUSTRI BARANG DARI LOGAM SIAP PASANG UNTUK KONSTRUKSI LAINNYA","","","11/29/2016 08:19:39","","","","6","11/29/2016 08:19:39","",""
"992","2512","INDUSTRI TANGKI, TANDON AIR DAN WADAH DARI LOGAM","","","11/29/2016 08:19:39","","","","6","11/29/2016 08:19:39","",""
"993","25120","INDUSTRI TANGKI, TANDON AIR DAN WADAH DARI LOGAM","","","11/29/2016 08:19:39","","","","6","11/29/2016 08:19:39","",""
"994","2513","INDUSTRI GENERATOR UAP, BUKAN KETEL PEMANAS","","","11/29/2016 08:19:39","","","","6","11/29/2016 08:19:39","",""
"995","25130","INDUSTRI GENERATOR UAP, BUKAN KETEL PEMANAS","","","11/29/2016 08:19:39","","","","6","11/29/2016 08:19:39","",""
"996","252","INDUSTRI SENJATA DAN AMUNISI","","","11/29/2016 08:19:39","","","","6","11/29/2016 08:19:39","",""
"997","2520","INDUSTRI SENJATA DAN AMUNISI","","","11/29/2016 08:19:39","","","","6","11/29/2016 08:19:39","",""
"998","25200","INDUSTRI SENJATA DAN AMUNISI","","","11/29/2016 08:19:39","","","","6","11/29/2016 08:19:39","",""
"999","259","INDUSTRI BARANG LOGAM LAINNYA DAN JASA PEMBUATAN BARANG LOGAM","","","11/29/2016 08:19:39","","","","6","11/29/2016 08:19:39","",""
"1000","2591","INDUSTRI PENEMPAAN, PENGEPRESAN, PENCETAKAN DAN PEMBENTUKAN LOGAM; METALURGI BUBUK","","","11/29/2016 08:19:39","","","","6","11/29/2016 08:19:39","",""
"1001","25910","INDUSTRI PENEMPAAN, PENGEPRESAN, PENCETAKAN DAN PEMBENTUKAN LOGAM; METALURGI BUBUK","","","11/29/2016 08:19:39","","","","6","11/29/2016 08:19:39","",""
"1002","2592","JASA INDUSTRI UNTUK BERBAGAI PENGERJAAN KHUSUS LOGAM DAN BARANG DARI LOGAM","","","11/29/2016 08:19:39","","","","6","11/29/2016 08:19:39","",""
"1003","25920","JASA INDUSTRI UNTUK BERBAGAI PENGERJAAN KHUSUS LOGAM DAN BARANG DARI LOGAM","","","11/29/2016 08:19:39","","","","6","11/29/2016 08:19:39","",""
"1004","2593","INDUSTRI ALAT POTONG, PERKAKAS TANGAN DAN PERALATAN UMUM","","","11/29/2016 08:19:39","","","","6","11/29/2016 08:19:39","",""
"1005","25931","INDUSTRI ALAT POTONG DAN PERKAKAS TANGAN UNTUK PERTANIAN","","","11/29/2016 08:19:39","","","","6","11/29/2016 08:19:39","",""
"1006","25932","INDUSTRI ALAT POTONG DAN PERKAKAS TANGAN PERTUKANGAN","","","11/29/2016 08:19:39","","","","6","11/29/2016 08:19:39","",""
